text,hand_annotated,clear_vague
"put in headphones/ear buds dont make eye contact. if you have to go downtown you wont to be able to avoid them, the bus stop and library area are bad for these types of people. and yes this population of people love to use racism as a way to get attention.walk close to other people walking (within reason) . 

most of them want smokes or change or attention.",language of fear/disgust/danger ,vague
Are you seriously comparing the damage that excess MJ can do to a first timer vs. what excess alcohol can do to a first timer? When's the last time you saw a 14 y.o. die from marijuana poisoning?,language of fear/disgust/danger ,vague
"I had a friend sell moonshine from his room on a campus which was highly restrictive about alcohol. He covered his tuition(including residence) before the end of October, and was just raking it in after that. He sold a small U-Haul trailer-full every couple of weeks. To put this in perspective, it was over 1000 jars per trailer and he sold them for about $20 per. His cost (from family was about $5). Thus he cleared about $15k per trailer.

The only crappy part was he had to do his entire 6 years of his 2 degrees in the crappiest residence (best location for sales). His main complaint was all the drunken partying.

Looking at the experiences I've been told about dry oil field work camps is if you don't provide alcohol, someone will, and many will provide drugs. The braniacs running them then started testing for these drugs which meant people started taking nightmare drugs for which there were no tests. But as one friend who worked in safety told me about just letting booze in to try to reduce drug and weird drug use, ""Never going to happen. These camps aren't dry for safety, they are dry for religious nut reasons. Safety is just the excuse.""",language of fear/disgust/danger ,vague
The best way to avoid drug overdose is to not taking drugs,language of fear/disgust/danger ,vague
"For sure, but fentanyl ends your life lickedy split.",language of fear/disgust/danger ,vague
"That's what the safe supply people don't get. Once you build up more tolerance to opioids, the ""safe"" ones won't even be effective anymore. It's just delaying the inevitable.",language of fear/disgust/danger ,vague
 I witness people using drugs openly at the stations daily! A couple days ago there were some people oh you know just sharing a dart on the train!!! There was a slow clap when the butted it out. It's pretty bad.,language of fear/disgust/danger ,vague
"But isn't this the logical conclusion to ""safe supply""? 

In theory any resistance to getting drugs could lead someone to the black market of contaminated drugs. Clearly that would include having to find a doctor willing to give someone a prescription.",language of fear/disgust/danger ,vague
"So.. legally using alcohol, amphetamines, and cannabis are bad behavior?",language of fear/disgust/danger ,vague
Wednesday last week I saw 2 CPS officers standing behind a car that was parked in the wrong spot writing a ticket while 2 people are strung out across the street smoking fent. They couldn't give 2 shits and just want to ignore the issue until they die it seems. Some intervention would be the compassionate approach IMO instead of worry about a car that wasn't even interfering in anything.,language of fear/disgust/danger ,vague
To be honest the return on investment is probably incredible - a lot easier to give someone clean drugs then revive them from an overdose after they take poisoned drugs.,language of fear/disgust/danger ,vague
"My brother used shrooms, in conjunction with weed and alcohol, and it turned him into a monster.  He's currently sitting in prison awaiting trial for multiple offenses he committed since he started using.

So, while part of me appreciates and envied the experiences shared regarding op's use, I'm too scared to partake myself.",language of fear/disgust/danger ,vague
"Too bad. SGI and SPS are more than happy to penalize you tomorrow for using weed last night. Quit booze and used weed in the past X days? Well then here's an impoundment, traffic act conviction, and $$$ fines for having the smallest trace of weed in your system the next morning/week. All 'for public safety'.  
It's enough BS to start drinkin' again...",Not language of fear/disgust/danger ,clear
"Fair enough. Maybe you should smoke harder, get that THC concentration in your fat cells up lol",Not language of fear/disgust/danger ,clear
Lololol you probably think that thc is the only contributing factor to the experience of smoking cannabis bahaha pleb,Not language of fear/disgust/danger ,clear
"Pathetic lol it's weed.

The cops in NB are just glorified hall monitors. I'm sure they went to the bar afterwards to celebrate their big bust 😆🤦🏻‍♂️",Not language of fear/disgust/danger ,clear
Just take a bunch of ephedrine like a responsible adult then.,Not language of fear/disgust/danger ,clear
"It's funny in the U.S. these huge drug seizures are no longer featured on the news as much as they used to be. You know why? The Americans figured out that even a $90 million worth of cocaine isn't shit in the grand scheme off things. It's funny to see Canadians ""wowed"" by these reports.",Not language of fear/disgust/danger ,clear
Interesting combinations can be made when you take into account weed and alcohol and can only choose three.,Not language of fear/disgust/danger ,clear
"Psilocybin (magic mushrooms). Start researching the positive effects clinical trials are showing. There is no way to get proper psychotherapy right now but you can heavy dose yourself (3-4g) and have someone sober watch over you and make sure you stay on a good path. They are also starting to treat alcohol disorders with the same. It starts to re-path the brain and the way the brain operates. it rebuilds neuro-pathways.

It sounds like you are desperate for a solution. It may be worth looking into. Do your research. You can buy mushrooms online now in Canada. Look at shroombros or organicshrooms Canada. Start with something easy like Golden Teachers. Once you are comfortable start trying these like Penis Envy.

You can also start microdosing if this is something that works for you. Trip once every 3-4 weeks while you are feeling down. Microdose when you are not tripping.

Best of luck to you. You have already made the first step. You realize the problem and are looking for solutions. Stay strong.",Not language of fear/disgust/danger ,clear
Hmm that's interesting. You save more money buying drugs in larger quantities.,Not language of fear/disgust/danger ,clear
"Your understanding of the opioid crisis is too basic for this discussion. I’m taking classes this semester with a research scientist with the BC Centre on substance use, and have read large amounts of academic literature on the topic. 

The “war on drugs” caused and/or exacerbated every single harm from drug use at astronomical rates. The first step is to discontinue the practices that increase the harm - which is why everyone with even the most moderate education in the topic celebrated decriminalization and supports free needle access, supervised injection sites, and safe supply supports. 

Just because you feel like something is true doesn’t mean it is.",Not language of fear/disgust/danger ,clear
"It's crazy how stable drug prices are.

I read somewhere that blow was around $80 - 100 / gram since the 70s. 

Can basically confirm all (um ok not crack...) have been basically the same since the 90s. Same for weed and mushies and lsd too...",Not language of fear/disgust/danger ,clear
"The margins on anything sold at retail will always be right at the top of what people will pay.

There's no way if we went to fully private liquor retail tomorrow that the prices would be cheaper.  If we're already used to paying $40 for a bottle, they'll charge $40 for the bottle whatever that margin is.  Why would they charge $30 if people will pay $40?",Not language of fear/disgust/danger ,clear
I would like some free cocaine please.,Not language of fear/disgust/danger ,clear
That is a meth pipe,Not language of fear/disgust/danger ,clear
"I live in Alberta,Canada and supposedly there is over 600 weed shops in our province.  Competition is a good thing.",Not language of fear/disgust/danger ,clear
"West Queen West might not even be a neighbourhood anymore, I think they’ve all been evicted to add more weed shops.",Not language of fear/disgust/danger ,clear
"Oops. I just noticed they have 'and drink beer' in their bio ¯\_( ͡° ͜ʖ ͡°)_/¯

But I'm sure that's optional. Either way, good luck!",Not language of fear/disgust/danger ,clear
Just buy government weed? Lol,Not language of fear/disgust/danger ,clear
"Iunno, a pot of beer for $28 is pretty brutal.",Not language of fear/disgust/danger ,clear
"It’s unfortunately extremely common. I got drugged at (coincidentally) the kings head back in the fall and woke up next to a stranger. I didn’t have much to drink at all- 4 beer. But the night is completely blank for me. Went to hospital and police the next day when I woke up. Was so messed up I still wasn’t safe to drive come 4pm when I woke up. Cops have told me that while they’re trying, it’s really difficult to actually prove anything in cases like this.",Not language of fear/disgust/danger ,clear
I was on seroquel before. I didn’t help at all. Then I tried trazodone but my body didn’t handle that well at all. I’m currently taking zopiclone but it has stopped working. I’ve tried to pause the zopiclone for a bit and resume to see if it would kick in again but I’ve not had any results other than being exhausted and awake.,Not language of fear/disgust/danger ,clear
One cocaine please.,Not language of fear/disgust/danger ,clear
Drugs here in Van can be good. Ive tested both K and M several times and its come back as 100% a few times.,Not language of fear/disgust/danger ,clear
New to drugs. How many servings is 3.5 grams of cocaine?,Not language of fear/disgust/danger ,clear
"This sure sounds like an endorsement of enforcement as opposed to decriminalization.

If the suppliers are *scared off* by police raiding storefront class A drug dealing operations, or even just run of the mill plugs, wouldn't the logical conclusion be that enforcement works?

Considering that even high quantity seizures have had almost no impact on the market, or the freedom under which that market operates, it seems clear that no suppliers are scared off by our timid attempts at enforcement against the illegal drug trade.",Not language of fear/disgust/danger ,clear
"Alcohol in parks is good
Freedom",Not language of fear/disgust/danger ,clear
Mdma is too expensive,Not language of fear/disgust/danger ,clear
For real. What a waste of time. Who cares about a bag that used to have cocaine in it.,Not language of fear/disgust/danger ,clear
"""I eat cigarettes for breakfast, and coffee for lunch."" song for a chicken named jenny - pat the bunny",Not language of fear/disgust/danger ,clear
Headline.... Drug deal gone good.,Not language of fear/disgust/danger ,clear
"London Drugs's profit goes brrrrrrrrr.📈↗️

Imagine buying hard drugs with your ducknana.🦆",Not language of fear/disgust/danger ,clear
"I bought myself a soda stream, then mix carbonated water, Mio, lemon or lime juice, and some vodka (can be tequila or gin or any other liquor). It’s definitely the cheapest form of home-made mixed drinks.",Not language of fear/disgust/danger ,clear
"There is no free market. Cannabis is heavily regulated and has a barrier to entry. The grey market sites will have to live with the threat of being shutdown should the police crackdown on it. 

The rules do not favour independent shops. I am not saying that is good or bad.  All markets are regulated and generally favour larger entities.",Not language of fear/disgust/danger ,clear
"I mean you are reading the whole study wrong. It says up to 8 days in ""extreme cases"". Also says randomly selected people, as I've said previously, multiple times, over and over.... It is not a random selection, we would already have REASONABLE GROUNDS TO BELIEVE you recently consumed weed, AND THEN we collect the sample.

I'm not going to continue to reply. If people have concerns they should bring it to their representatives.",Not language of fear/disgust/danger ,clear
"There is also a Tokyo Smoke store on Younge St., a few steps away from the Eaton center, near the food trucks area. Then there is another cannabis store across the street from that. clustering indeed.",Not language of fear/disgust/danger ,clear
Last time I said this I was down voted to oblivion with defenders of nslc weed that is just as good as 100$ ounces from the crustiest delivery services there is.,Not language of fear/disgust/danger ,clear
"Where should I start? Inferior product quality, higher prices, most of which is taxes, which lead to lower wages for the entire supply chain, which leads to strikes because why would I work at a dispensary and make $15/hr if I can sell weed around my neighborhood and make 3x that.  Which leads to the reemergence of grey market, something that legalization was supposed to take care of.",Not language of fear/disgust/danger ,clear
"There are tradeoffs between lifestyle and money that everyone is making. I had friends in uni that were too cheap to buy their own alcohol and slept in a closet, but had a pass at Whistler. If you want to drink beer, brewing it yourself isn't an unreasonable way to save some cash. I imagine OP likes going to the gym as a third space in their life, and saving a few bucks on other things is the bonus.",Not language of fear/disgust/danger ,clear
"TBH, the first device that is capable of doing this which will likely be the Cannabix device, will quickly be introduced everywhere including police departments, workplaces and sport leagues. As a result, I see a huge jump in recreational weed use by people who are at this point in time skeptical of the current testing options out there like the Draeger swabs and choose to not indulge. I myself work at a company that has random testing and I do not trust that the testing is reliable or accurate enough to consume while employed at my company. This breathalyzer will change that for me.",Not language of fear/disgust/danger ,clear
"Better than the bathrobe dude? Thats the bar for quality? Weed has been legal for 5 years now and it's huge business. I think we can do better at this point than ""it's better than the bathrobe guy"".",Not language of fear/disgust/danger ,clear
Non-alcohol beers are getting to be pretty common in pubs.,Not language of fear/disgust/danger ,clear
If you're asking if you can come buy magic mushrooms on the rez the answer is no lol We don't sell weed either.,Not language of fear/disgust/danger ,clear
"I don't know of any CBD prescriptions, but I do know the Cannabis NBs that I've been to don't sell it, they say nobody wants it. I'd just order online.",Not language of fear/disgust/danger ,clear
"Definitely doing dry January, did it last year too. Think I might go further and give up alcohol until spring break, other than social/work engagements.   Had enough of drinking at home alone",Not language of fear/disgust/danger ,clear
It’s illegal to smoke cannabis in public in Quebec,Not language of fear/disgust/danger ,clear
Early Highline had some weird beers. But the last couple years they have been stellar. Trivia night is also super popular and fun.,Not language of fear/disgust/danger ,clear
"Wow that should be on the welcome brochure.

**Welcome to Vancouver! Get some Free heroin, Cocaine and Meth**",Not language of fear/disgust/danger ,clear
"Is this about the switch on the formulary from methadone to methadose (the premixed kind)? I was surprised the bc government didnt switch back to it given how many people said it didnt work compared to methadone. 

Also I feel you on the private fees thing. Trying to get someone I care about into treatment and he is willing to try OAT but unless you have money to pay after detox there is like no bed for treatment and long term coverage of methadone is hard if you rely on formulary.   I don't understand why the bc Gov doesnt make it all free to people especially those under a certain income  for ANY formulation that works. Suboxone is great for some folks, methadone is great for others, should be able to pick the onethat works best. Bc makes it so hard to get free treatment withquality meds even for those fully ready to get in",Not language of fear/disgust/danger ,clear
Same reason you can't bring beer in I assume.,Not language of fear/disgust/danger ,clear
"From the title: ""apparently alcohol/drugs related""

source?",Not language of fear/disgust/danger ,clear
"Pure market capitalism will balance that all out. There’s demand, but not *that* much demand. Victoria, BC had a similar situation (albeit before weed was legal). In the end some folded and some thrived.",Not language of fear/disgust/danger ,clear
"You make some good points, but why the hell would I meet some guy in a parking lot to buy weed like it's high school when I can just go to a storefront. The convenience factor alone is worth a couple of bucks",Not language of fear/disgust/danger ,clear
"Good.

private liquor stores are a headache and a half.",Not language of fear/disgust/danger ,clear
"They already are. My pal owns a couple of independent cannabis stores and is getting whooped by the big companies popping up around his stores. It's a war of attrition and the regular owners are going to struggle big time to keep up, if they can at all",Not language of fear/disgust/danger ,clear
"This was the program I graduated from in 2019. Cannabis wasn’t even a thought in that program at the time, but it still helped me land the Health Canada approved Quality Assurance Person role I have today for an amazing local LP 💚💚",Not language of fear/disgust/danger ,clear
That's what leads to people continuing to buy it off the black market. Notice how we didn't make nearly the amount of money off legal weed that we had anticipated,Not language of fear/disgust/danger ,clear
"More options for places to buy wine won't increase the amount of wine people will buy. Wine is already maximally available, and the profits all go back into public coffers. We don't need to cut in corporations on a system that works very well for us.",Not language of fear/disgust/danger ,clear
"I disagree, because ""the liquor is being transported or used in accordance with a license or permit issued under this Act;""  Section 54.4 allows transport when bought from a duly licensed facility.  It isn't the transported that needs the license, it is the seller.",Not language of fear/disgust/danger ,clear
Public consumption next I hope. If someone can smoke cigarettes and nic vapes in public then I should be able to smoke a weed vape in the same place,Not language of fear/disgust/danger ,clear
"No dude, it HAS to be unopened. ""Cases where liquor is open -- the cap or cork is removed -- in a motor vehicle will continue to be prosecuted.""

""The rules for transporting cannabis in a vehicle are the same as alcohol. Cannabis must be in a closed, sealed package and out of reach from anyone in the vehicle. You can be fined up to $2,000 for improper storage.""",Not language of fear/disgust/danger ,clear
This! Nobody cares if you consume cannabis in Vancouver. I feel these judgements will be regional.,Not language of fear/disgust/danger ,clear
In the year 2023 we still can't buy a beer in a corner store. Welcome to NS where we're still stuck in the stone ages.,Not language of fear/disgust/danger ,clear
"Hey now, scotch is grand. Marijuana still feels illegal. 

I may be aging myself.  ;)",Not language of fear/disgust/danger ,clear
He was selling it as meth.,Not language of fear/disgust/danger ,clear
what happens when the opiates run out? Or has that stopped being an issue with cheap ubiquitous fentanyls?,Not language of fear/disgust/danger ,clear
"Just a market correction.

There are **so many** cannabis stores around. No way they could all make a go of it.",Not language of fear/disgust/danger ,clear
One hundred percent. Part of me wishes they would have never made it legal til they developed a test that can accurately discern the difference between someone actually being impaired and someone having residual cannabis in their system...,Not language of fear/disgust/danger ,clear
100% agree. The fact that we have private cannabis stores but not booze is case in point. Let me get a bottle of god damn wine at the grocery store. Let private enterprise sell booze. It’s not complicated.,Not language of fear/disgust/danger ,clear
Meth seems to be reasonable I suppose,Not language of fear/disgust/danger ,clear
"That's not entirely accurate. Dougie did his part, lowering the lowest legal amount a beer could be sold for, but the problem is there wasn't just a boat load of beer companies willing to not make as much money as possible and they didn't feel the need to drop their prices. It was a bad promise, but he did keep it",Not language of fear/disgust/danger ,clear
Never had a problem at Cannabis nb.,Not language of fear/disgust/danger ,clear
"The back end of testing hasn't been invested in to provide support to these services. There is one toxicology department in the province to support urine drug screens which indicate the drugs found in the system. 

Often it's not the drugs the person knows they are taking that is the issue, it's the ones they don't know they are taking. Fentanyl laced cocaine or methamphetamine. Etizolam is a big one too.",Not language of fear/disgust/danger ,clear
"It is relevant.  In the same way you choose to endure certain things when you choose shared accommodations like apartments in duplexes, you also choose to accept some responsibility for the impact of your actions on others.  Footsteps from the neighbours above?  Tough luck, but that doesn’t give you the right to be the upstairs neighbour and pound on the floor with a hammer.  Have your own home in the country?  Go ahead and pound your floors with a hammer all you like.

The point is that it boils down to reasonableness.  What would a reasonable person expect and tolerate?  It doesn’t matter if it is weed smoke, cigarette smoke, or a kid practicing bagpipes, is the action causing unreasonable interference?  You aren’t going to get that from a reddit post, that is going to be up to a court to decide in a civil action.",Not language of fear/disgust/danger ,clear
I want some cocaine just to do this.,Not language of fear/disgust/danger ,clear
What about a truck? Booze or weed?,Not language of fear/disgust/danger ,clear
We spend 360M a year on the DTES right now. The problem is that we have seen zero benefits from that spending. Specifically because the advocates don't fight for treatment or prevention... Only more free drugs. Ever wonder why city councilors are handing out drugs but we have no treatment options?,Not language of fear/disgust/danger ,clear
Lap dances and drug prices never change.,Not language of fear/disgust/danger ,clear
Had to go a few years back eh. Really unfortunate you don’t know good weed when you see it,Not language of fear/disgust/danger ,clear
"Because you are able to do that with alcohol, or because that’s how you think it should be with weed specifically? Im just trying to figure out where y’all are coming from",Not language of fear/disgust/danger ,clear
"That is really cool. Speaking from personal experience, there are times where you are either temporarily or permanently, taking a break from alcohol but still want to hang out with friends in a bar and enjoy the food/company.",Not language of fear/disgust/danger ,clear
"Most people take drugs everyday. Coffee is a drug, same thing with Tylenol or birth control etc etc. I believe even alcohol is considered a drug.",Not language of fear/disgust/danger ,clear
Lol this is true after 17 years of science / neuro /psych study / bio /pharma and clinical and personal experience with opioids for 7 years,Not language of fear/disgust/danger ,clear
"Weird hill to die on for a government run business that does a grand total of $200,000 in revenue per year. Move aside and focus on core services, which selling weed is not.",Not language of fear/disgust/danger ,clear
"Many do want heroin but are unable to access it, you are correct that some people do in fact want fentanyl. If people know the strength of the fentanyl they were taking it could be used more safely. In fact, places in Vancouver and Victoria are prescribing fentanyl to some people in very small pilot projects.",Not language of fear/disgust/danger ,clear
That is totally false. The approved drug screening equipment typically will detect thc in your saliva up to 4 hours,Not language of fear/disgust/danger ,clear
A radio report earlier today said that his cocaine toxicity was 10 times the lethal amount.,Not language of fear/disgust/danger ,clear
"Well you can skip testing with Magic mushroom, all you need is a weight scale and you're good to go.",Not language of fear/disgust/danger ,clear
"Open up a competing store with ethically sourced, Fair-Trade™️ cocaine",Not language of fear/disgust/danger ,clear
I'm sure there will be a very thorough investigation into the $140M worth of cocaine.,Not language of fear/disgust/danger ,clear
I’m thinking that was A LOT of cocaine…,Not language of fear/disgust/danger ,clear
400kg of cocaine you say?,Not language of fear/disgust/danger ,clear
