text,hand_annotated,clear_vague
"As a result of the changes to the act, liquor may be transported: in the trunk or another part of a vehicle designed for carrying baggage or goods; behind the rear seat of vehicles that do not have a trunk (such as vans or hatchbacks); in an exterior compartment; or in a place that is not readily accessible to any person in a pickup truck.",Not language of fear/disgust/danger ,clear
Why is crack more expensive?? Isn’t it just coke mixed with baking soda?,Not language of fear/disgust/danger ,clear
"Is it prohibited? Yes

Should it be? Only in the same way cigarettes are.",Not language of fear/disgust/danger ,clear
"If you just bought some cannabis it is most likely in a still sealed container.

Fuck the police. Wish it weren’t true but everyday we see more and more… ACAB",Not language of fear/disgust/danger ,clear
"Most people should know this, but if you love beer and want to drink on the cheap, consider the single foreign made 500 mL cans sold at the liquor store instead of a 6 pack. If you buy 4 of these, it's the same as getting a six pack of smaller cans; the volume of beer is practically identical for both. And very often, BC Liquor, or whoever, has the singles for 1.99. so your only paying $8 for what is essentially a 6 pack, and a lot of these beers are very good. Sure, limited selection, but like I said, it's for when you don't want to spend a fortune on beer but still want to have a decent 6 pack's worth of it around.",Not language of fear/disgust/danger ,clear
"If you're actually honest, Bill 108 was positive from a housing policy perspective, and more generally, the pressure they are applying on municipalities to intensify is much preferred than the Liberal's decades of enabling NIMBYism. Their use of MZO's (in most cases) has also delivered more housing than the City would have otherwise supported. 

I also support the privitization of the cannabis retail system, the brute-forcing of the Ontario Line, reducing the size of City Council, eliminated/reduced rebates for some electric cars, reducing of pharmacare to apply only to individuals without private insurance, and getting rid of drive clean.",Not language of fear/disgust/danger ,clear
"Wow, weed and alcohol, I wonder how I would've survived during this strike!",Not language of fear/disgust/danger ,clear
Like alcohol consumption sites stop clustering or bars. 🙄,Not language of fear/disgust/danger ,clear
It’s been my go-to for a few years now. Personally enjoy it much more than the other comparably priced vodkas you can buy here.,Not language of fear/disgust/danger ,clear
"This might not work for others, but it worked wonfers for me.

The worst part of quitting/cutting back for me was the withdrawal symptoms, especially at night when I tried to sleep.

So I started taking vitamin water and mixing it with a cannabis THC/CBD oil. I did this because:

1. Alcohol saps a lot of vitamins out your system sobrhe added vitamins helped a lot.

2. The anti-inflammatory and slight high I got from the cannabis products reduced the inflammation in my body and helped curb the withdrawals and cravings.

Note, that this can worsen the quality of your sleep overtime, so I wouldn't recommend doing it more than 3 days in a row.

Also, if you haven't please consult with a doctor. 

And finally, I'm proud of you and wish you all the best. If you have any questions feel free to comment or DM.",Not language of fear/disgust/danger ,clear
"Wait, you can tell what kind of drugs they're doing from your car, while driving by? That's some next level vision you got there. I'm jealous. Also, keep your eyes on the road.",Not language of fear/disgust/danger ,clear
"Yeah, I heard of the BC heroin policy. Thought it was a pilot project that wasn't renewed?",Not language of fear/disgust/danger ,clear
"I microdose mushrooms every couple days and Ill take a break and do a larger dose one weekend.  I usually smoke weed daily, I use it as a form of medication for anxiety and PTSD rather than using any prescription pills. It works for me. Im what you would describe as ""lower middle class"". I drink maybe once or twice a year, not much at all.",Not language of fear/disgust/danger ,clear
I'm always curious on how much manpower and resources it cost to take away probably less than 1% of the coke on the streets.,Not language of fear/disgust/danger ,clear
"Looks like a powder but ive seen it now commonly in pill form, abd meth can be crushed into a powder.",Not language of fear/disgust/danger ,clear
"This is why a lot of public health experts recommend legalizing all drugs so that there is a safe supply. The idea being that you need to meet people where they are, not where you want them to be. Obviously this is a controversial idea and this is why it hasn't made much headway over here.",Not language of fear/disgust/danger ,clear
"Well we have bars for people consuming alcohol.

Maybe we need an equivalent for smoking pot. Don't you think? The laws changed relatively recently and some parts of society have still not caught up.",Not language of fear/disgust/danger ,clear
You will not find a study that correlates excess drug toxicity deaths with access to safe supply.,Not language of fear/disgust/danger ,clear
"that is hard, when I worked in addictions, every single opioid case I had was the result of a doctor. much hugs",Not language of fear/disgust/danger ,clear
It will cater to the 30+ crowd that has money. Don't expect beer specials.,Not language of fear/disgust/danger ,clear
"For lager, the Asahi zero alcohol tastes very close to their standard. I have heard very good things about Guiness Zero (if you like stout). The Clausthaler zero is a friend of mines favourite non alcohol pilsner.",Not language of fear/disgust/danger ,clear
Same. Company. Sundial = Spiritleaf = Value Buds = Liquor Depot.,Not language of fear/disgust/danger ,clear
"I was about to make this comment on a post about alcohol that was getting dozens of private liquor store answers. It's so much easier to just open google maps and check, I wonder why people make posts on Reddit and wait for people to reply? Is it for karma?",Not language of fear/disgust/danger ,clear
Only if you inject the weed.,Not language of fear/disgust/danger ,clear
"It is absolutely becoming more popular! I’m staying out in the sticks this month and the small town grocery store here has an entire shelf of nonalcoholic craft beers. I tried the St. Ambroise nonalcoholic pale ale in a can, and it was pretty good! Next time I’m there I expect that’ll be my second pint. Sober Carpenter is also good, if you like wheat beers they have one that is very citrus/coriander flavoured.",Not language of fear/disgust/danger ,clear
There is lots of alcohol around.  Go support a local brewery.,Not language of fear/disgust/danger ,clear
I would recommend to get a few naloxone kits-- fentanyl ODs can require multiple doses. I've heard of 8 nasal doses being administered at one time (it worked).,Not language of fear/disgust/danger ,clear
"That's one of the reasons I'm torn about our liquor sales laws.

I am firmly in favor of MLCC retail, the union jobs that pay a livable wage, keeping money in the province. I wouldn't give that up for Kirkland.

I wouldn't be opposed if stores were allowed to carry their house brand of liquor, while everything else continues to go through MLCC.",Not language of fear/disgust/danger ,clear
"How does the commerce of tobacco,  cannabis and the casinos in Khanawake play into internal politics there?",Not language of fear/disgust/danger ,clear